{
  "label": "bundle-YYYY-MM-r1",
  "dataset_version": "REPLACE_WITH_FROZEN_SPLIT_HASH",
  "seed": 42,
  "visual_version": "REPLACE_WITH_CLIP_SSCD_ARTEFACT_VERSION",
  "textual_version": "REPLACE_WITH_TFIDF_TEXT_CUES_ARTEFACT_VERSION",
  "behavioural_version": "REPLACE_WITH_XGBOOST_ARTEFACT_VERSION",
  "fusion_version": "REPLACE_WITH_META_CLASSIFIER_VERSION",
  "calibrator_version": "REPLACE_WITH_CALIBRATOR_VERSION",
  "explanation_templates_version": "templates-v1",
  "category_baselines": {},
  "band_boundaries": {
    "low_max": 0,
    "moderate_max": 0
  },
  "artifact_hashes": {},
  "dependency_lock_hash": "REPLACE_WITH_64_CHARACTER_SHA256",
  "development_stub": false
}
